{
  "$schema": "https://json-schema.org/draft/2020-12/schema",
  "$id": "K501-AGGREGATE-FILE-LICENSE-MAP-SCHEMA-1.0",
  "type": "object",
  "required": ["schema_id", "artifact_id", "artifact_version", "attestation", "default_rule", "entry_count", "entries"],
  "properties": {
    "schema_id": {"type": "string", "const": "K501_AGGREGATE_FILE_LICENSE_MAP/1.0"},
    "artifact_id": {"type": "string"},
    "artifact_version": {"type": "string", "const": "3.5.0"},
    "attestation": {"type": "string"},
    "default_rule": {"type": "string"},
    "entry_count": {"type": "integer"},
    "entries": {"type": "array", "minItems": 1, "items": {"type": "object", "required": ["path", "kind", "spdx", "status", "basis", "scope_note"], "properties": {"path": {"type": "string"}, "kind": {"type": "string"}, "spdx": {"type": "string"}, "status": {"type": "string"}, "basis": {"type": "string"}, "scope_note": {"type": "string"}}}}
  },
  "additionalProperties": true
}
