{
  "schema_id": "K501_AGGREGATE_FILE_LICENSE_MAP/1.0",
  "artifact_id": "K501-AIONARC-INTEGRATED-PIPELINE-PROOF-RUNTIME",
  "artifact_version": "3.5.0",
  "attestation": "metadata/RIGHTSHOLDER_ATTESTATION.json",
  "default_rule": "NOASSERTION; every distributable path is explicitly classified; preserve upstream notices and terms.",
  "entry_count": 296,
  "entries": [
    {
      "path": ".gitignore",
      "kind": "software_or_build_code",
      "spdx": "MIT",
      "status": "OWNER_DECLARED",
      "basis": "metadata/RIGHTSHOLDER_ATTESTATION.json",
      "scope_note": "Owner declaration 1793046600."
    },
    {
      "path": "CHANGELOG.md",
      "kind": "documentation_specification_or_metadata",
      "spdx": "CC-BY-4.0",
      "status": "OWNER_DECLARED",
      "basis": "metadata/RIGHTSHOLDER_ATTESTATION.json",
      "scope_note": "Owner declaration 1793046600; any third-party material remains separately scoped."
    },
    {
      "path": "CITATION.cff",
      "kind": "documentation_specification_or_metadata",
      "spdx": "CC-BY-4.0",
      "status": "OWNER_DECLARED",
      "basis": "metadata/RIGHTSHOLDER_ATTESTATION.json",
      "scope_note": "Owner declaration 1793046600; any third-party material remains separately scoped."
    },
    {
      "path": "Index.json",
      "kind": "integrity_or_index_record",
      "spdx": "NOASSERTION",
      "status": "INTEGRITY_METADATA",
      "basis": "INTEGRITY_METADATA",
      "scope_note": "Generated index or integrity data; no license assertion over factual digests."
    },
    {
      "path": "Index.md",
      "kind": "integrity_or_index_record",
      "spdx": "NOASSERTION",
      "status": "INTEGRITY_METADATA",
      "basis": "INTEGRITY_METADATA",
      "scope_note": "Generated index or integrity data; no license assertion over factual digests."
    },
    {
      "path": "LICENSE",
      "kind": "documentation_specification_or_metadata",
      "spdx": "CC-BY-4.0",
      "status": "OWNER_DECLARED",
      "basis": "metadata/RIGHTSHOLDER_ATTESTATION.json",
      "scope_note": "Owner declaration 1793046600; any third-party material remains separately scoped."
    },
    {
      "path": "LICENSES/AGGREGATE_FILE_LICENSE_MAP.csv",
      "kind": "documentation_specification_or_metadata",
      "spdx": "CC-BY-4.0",
      "status": "OWNER_DECLARED",
      "basis": "metadata/RIGHTSHOLDER_ATTESTATION.json",
      "scope_note": "Owner declaration 1793046600; any third-party material remains separately scoped."
    },
    {
      "path": "LICENSES/AGGREGATE_FILE_LICENSE_MAP.json",
      "kind": "documentation_specification_or_metadata",
      "spdx": "CC-BY-4.0",
      "status": "OWNER_DECLARED",
      "basis": "metadata/RIGHTSHOLDER_ATTESTATION.json",
      "scope_note": "Owner declaration 1793046600; any third-party material remains separately scoped."
    },
    {
      "path": "LICENSES/CC-BY-4.0.txt",
      "kind": "standard_license_text",
      "spdx": "NOASSERTION",
      "status": "PRESERVED_STANDARD_TEXT",
      "basis": "PRESERVED_STANDARD_TEXT",
      "scope_note": "Standard license text/reference; no ownership claim."
    },
    {
      "path": "LICENSES/MIT.txt",
      "kind": "standard_license_text",
      "spdx": "NOASSERTION",
      "status": "PRESERVED_STANDARD_TEXT",
      "basis": "PRESERVED_STANDARD_TEXT",
      "scope_note": "Standard license text/reference; no ownership claim."
    },
    {
      "path": "LICENSES/RIGHTSHOLDER_ATTESTATION.md",
      "kind": "documentation_specification_or_metadata",
      "spdx": "CC-BY-4.0",
      "status": "OWNER_DECLARED",
      "basis": "metadata/RIGHTSHOLDER_ATTESTATION.json",
      "scope_note": "Owner declaration 1793046600; any third-party material remains separately scoped."
    },
    {
      "path": "LICENSE_SCOPE.md",
      "kind": "documentation_specification_or_metadata",
      "spdx": "CC-BY-4.0",
      "status": "OWNER_DECLARED",
      "basis": "metadata/RIGHTSHOLDER_ATTESTATION.json",
      "scope_note": "Owner declaration 1793046600; any third-party material remains separately scoped."
    },
    {
      "path": "LICENSE_STATUS.md",
      "kind": "documentation_specification_or_metadata",
      "spdx": "CC-BY-4.0",
      "status": "OWNER_DECLARED",
      "basis": "metadata/RIGHTSHOLDER_ATTESTATION.json",
      "scope_note": "Owner declaration 1793046600; any third-party material remains separately scoped."
    },
    {
      "path": "MANIFEST.json",
      "kind": "integrity_or_index_record",
      "spdx": "NOASSERTION",
      "status": "INTEGRITY_METADATA",
      "basis": "INTEGRITY_METADATA",
      "scope_note": "Generated index or integrity data; no license assertion over factual digests."
    },
    {
      "path": "Makefile",
      "kind": "software_or_build_code",
      "spdx": "MIT",
      "status": "OWNER_DECLARED",
      "basis": "metadata/RIGHTSHOLDER_ATTESTATION.json",
      "scope_note": "Owner declaration 1793046600."
    },
    {
      "path": "NOTICE",
      "kind": "documentation_specification_or_metadata",
      "spdx": "CC-BY-4.0",
      "status": "OWNER_DECLARED",
      "basis": "metadata/RIGHTSHOLDER_ATTESTATION.json",
      "scope_note": "Owner declaration 1793046600; any third-party material remains separately scoped."
    },
    {
      "path": "README.md",
      "kind": "documentation_specification_or_metadata",
      "spdx": "CC-BY-4.0",
      "status": "OWNER_DECLARED",
      "basis": "metadata/RIGHTSHOLDER_ATTESTATION.json",
      "scope_note": "Owner declaration 1793046600; any third-party material remains separately scoped."
    },
    {
      "path": "SHA256SUMS.txt",
      "kind": "integrity_or_index_record",
      "spdx": "NOASSERTION",
      "status": "INTEGRITY_METADATA",
      "basis": "INTEGRITY_METADATA",
      "scope_note": "Generated index or integrity data; no license assertion over factual digests."
    },
    {
      "path": "SHA256SUMS.txt.sha256",
      "kind": "integrity_or_index_record",
      "spdx": "NOASSERTION",
      "status": "INTEGRITY_METADATA",
      "basis": "INTEGRITY_METADATA",
      "scope_note": "Generated index or integrity data; no license assertion over factual digests."
    },
    {
      "path": "STATUS.md",
      "kind": "documentation_specification_or_metadata",
      "spdx": "CC-BY-4.0",
      "status": "OWNER_DECLARED",
      "basis": "metadata/RIGHTSHOLDER_ATTESTATION.json",
      "scope_note": "Owner declaration 1793046600; any third-party material remains separately scoped."
    },
    {
      "path": "VERSION",
      "kind": "version_fact",
      "spdx": "NOASSERTION",
      "status": "FACTUAL_METADATA",
      "basis": "FACTUAL_METADATA",
      "scope_note": "Version identifier."
    },
    {
      "path": "components/K501-AIONARC-Pipeline/.gitignore",
      "kind": "software_configuration",
      "spdx": "MIT",
      "status": "OWNER_DECLARED",
      "basis": "metadata/RIGHTSHOLDER_ATTESTATION.json",
      "scope_note": "Classified as software/build configuration by the owner-ratified policy."
    },
    {
      "path": "components/K501-AIONARC-Pipeline/Gateway.json",
      "kind": "descriptive_metadata",
      "spdx": "CC-BY-4.0",
      "status": "OWNER_DECLARED",
      "basis": "metadata/RIGHTSHOLDER_ATTESTATION.json",
      "scope_note": "Classified as authored descriptive metadata by the owner-ratified policy."
    },
    {
      "path": "components/K501-AIONARC-Pipeline/Gateway.md",
      "kind": "documentation_or_metadata",
      "spdx": "CC-BY-4.0",
      "status": "OWNER_DECLARED",
      "basis": "metadata/RIGHTSHOLDER_ATTESTATION.json",
      "scope_note": "Owner declaration 1793046600; third-party exclusions preserved."
    },
    {
      "path": "components/K501-AIONARC-Pipeline/Index.json",
      "kind": "integrity_or_index_record",
      "spdx": "NOASSERTION",
      "status": "INTEGRITY_METADATA",
      "basis": "INTEGRITY_METADATA",
      "scope_note": "Generated index or integrity data; no license assertion over factual digests."
    },
    {
      "path": "components/K501-AIONARC-Pipeline/Index.md",
      "kind": "integrity_or_index_record",
      "spdx": "NOASSERTION",
      "status": "INTEGRITY_METADATA",
      "basis": "INTEGRITY_METADATA",
      "scope_note": "Generated index or integrity data; no license assertion over factual digests."
    },
    {
      "path": "components/K501-AIONARC-Pipeline/LICENSE",
      "kind": "license_scope_document",
      "spdx": "CC-BY-4.0",
      "status": "OWNER_DECLARED",
      "basis": "metadata/RIGHTSHOLDER_ATTESTATION.json",
      "scope_note": "Authored scope document; not a blanket license grant."
    },
    {
      "path": "components/K501-AIONARC-Pipeline/LICENSES/CC-BY-4.0.txt",
      "kind": "standard_license_text",
      "spdx": "NOASSERTION",
      "status": "PRESERVED_STANDARD_TEXT",
      "basis": "PRESERVED_STANDARD_TEXT",
      "scope_note": "Standard CC-BY-4.0 text; no ownership claim."
    },
    {
      "path": "components/K501-AIONARC-Pipeline/LICENSES/FILE_LICENSE_MAP.csv",
      "kind": "documentation_or_metadata",
      "spdx": "CC-BY-4.0",
      "status": "OWNER_DECLARED",
      "basis": "metadata/RIGHTSHOLDER_ATTESTATION.json",
      "scope_note": "Owner declaration 1793046600; third-party exclusions preserved."
    },
    {
      "path": "components/K501-AIONARC-Pipeline/LICENSES/FILE_LICENSE_MAP.md",
      "kind": "documentation_or_metadata",
      "spdx": "CC-BY-4.0",
      "status": "OWNER_DECLARED",
      "basis": "metadata/RIGHTSHOLDER_ATTESTATION.json",
      "scope_note": "Owner declaration 1793046600; third-party exclusions preserved."
    },
    {
      "path": "components/K501-AIONARC-Pipeline/LICENSES/K501_LICENSE_POLICY_V1.0.md",
      "kind": "documentation_or_metadata",
      "spdx": "CC-BY-4.0",
      "status": "OWNER_DECLARED",
      "basis": "metadata/RIGHTSHOLDER_ATTESTATION.json",
      "scope_note": "Owner declaration 1793046600; third-party exclusions preserved."
    },
    {